,序號,發言日期,發言時間,發言人,發言人職稱,發言人電話,主旨,符合條款,事實發生日,說明,公司代號
0,1,111/07/06,15:56:54,杜居燦,財務處處長,27062191#403,公告本公司董事會決議除息基準日相關事宜,第 14款,111/07/06,"1.董事會、股東會決議或公司決定日期:111/07/06 2.除權、息類別（請填入「除權」、「除息」或「除權息」）:除息 3.發放股利種類及金額:現金股利683,180,860元，每股配發新台幣1.7元。 4.除權（息）交易日:111/07/22 5.最後過戶日:111/07/25 6.停止過戶起始日期:111/07/26 7.停止過戶截止日期:111/07/30 8.除權（息）基準日:111/07/30 9.其他應敘明事項:現金股利發放日訂於111年08月15日。",1234
1,2,111/07/06,15:57:56,杜居燦,財務處處長,27062191#403,公告本公司薪資報酬委員會委員異動,第 6款,111/07/06,1.發生變動日期:111/07/06 2.功能性委員會名稱:薪資報酬委員會 3.舊任者姓名:李鳳翱、林火燈、簡敏秋 4.舊任者簡歷: (1)李鳳翱:均衡法律事務所主持律師 (2)林火燈:台灣證券交易所總經理 (3)簡敏秋:勤敏聯合會計師事務所主持會計師 5.新任者姓名:李鳳翱、林火燈、簡敏秋 6.新任者簡歷: (1)李鳳翱:均衡法律事務所主持律師 (2)林火燈:台灣證券交易所總經理 (3)簡敏秋:勤敏聯合會計師事務所主持會計師 7.異動情形（請輸入「辭職」、「解任」、「任期屆滿」、「逝世」或「新任」）: 任期屆滿 8.異動原因:任期屆滿 9.原任期（例xx/xx/xx ~ xx/xx/xx）:108/07/09~111/06/23 10.新任生效日期:111/07/06~114/06/22 11.其他應敘明事項:無。,1234
2,3,111/07/06,15:58:51,杜居燦,財務處處長,27062191#403,本公司董事會通過同意重要子公司黑松資產管理(股)公司 與微風廣場實業(股)公司之不動產租賃延長租賃期間 及延長期間租金不調漲案。,第 51款,111/07/06,1.事實發生日:111/07/06 2.公司名稱:黑松股份有限公司 3.與公司關係(請輸入本公司或子公司):本公司 4.相互持股比例:不適用。 5.發生緣由:本公司董事會通過同意重要子公司黑松資產管理(股)公司與 微風廣場實業(股)公司之不動產租賃協議書及相關備忘錄，修定延長租賃期間 及延長期間租金不調漲，相關修定內容如下： (1)延長租賃期間：自118年10月26日起延長3年(即至121年10月25日屆至) (2)延長租賃期間商場及停車位租金：以117年10月26日至118年10月25日之租金    作為基準租金。 (3)其他合約條件維持原合約規定不變動。 6.因應措施:無。 7.其他應敘明事項:無。,1234
3,4,111/07/06,15:59:48,杜居燦,財務處處長,27062191#403,代重要子公司黑松資產管理股份有限公司公告法人代表董事 及監察人改派,第 6款,111/07/06,1.發生變動日期:111/07/06 2.法人名稱:黑松股份有限公司 3.舊任者姓名: 董  事:張斌堂、張建章、張智鈞、張建國、程清屘 監察人:張建業 4.舊任者簡歷: 董  事:張斌堂/黑松股份有限公司董事長 董  事:張建章/黑松股份有限公司董事 董  事:張智鈞/黑松股份有限公司董事 董  事:張建國/黑松股份有限公司董事 董  事:程清屘/黑松股份有限公司董事 監察人:張建業/黑松股份有限公司董事 5.新任者姓名: 董  事:張斌堂、張建章、張智鈞、張建陽、程清屘 監察人:張建業 6.新任者簡歷: 董  事:張斌堂/黑松股份有限公司董事長 董  事:張建章/黑松股份有限公司董事 董  事:張智鈞/黑松股份有限公司董事 董  事:張建陽/黑松股份有限公司董事 董  事:程清屘/黑松股份有限公司董事 監察人:張建業/黑松股份有限公司董事 7.異動原因:任期屆滿，全面改選 8.原任期（例xx/xx/xx至xx/xx/xx）:108/07/08~111/07/07 9.新任生效日期:111/07/06~114/07/05 10.其他應敘明事項:無。,1234
4,5,111/07/06,16:01:08,杜居燦,財務處處長,27062191#403,代重要子公司黑松資產管理股份有限公司公告董事長選任,第 6款,111/07/06,1.董事會決議日期或發生變動日期:111/07/06 2.人員別（請輸入董事長或總經理）:董事長 3.舊任者姓名:黑松股份有限公司 代表人：張斌堂 4.舊任者簡歷:黑松股份有限公司董事長 5.新任者姓名:黑松股份有限公司 代表人：張斌堂 6.新任者簡歷:黑松股份有限公司董事長 7.異動情形（請輸入「辭職」、「解任」、「任期屆滿」、「職務調整」、「資遣」、 「退休」、「逝世」或「新任」）:任期屆滿 8.異動原因:任期屆滿重新選任 9.新任生效日期:111/07/06 10.其他應敘明事項:無。,1234
5,6,111/07/06,16:01:55,杜居燦,財務處處長,27062191#403,代重要子公司黑松資產管理(股)公司公告與微風廣場實業 (股)公司有關微風廣場不動產之延長租賃期間及延長期間租金 不調漲案。,第 51款,111/07/06,1.事實發生日:111/07/06 2.公司名稱:黑松資產管理股份有限公司 3.與公司關係(請輸入本公司或子公司):子公司 4.相互持股比例:不適用。 5.發生緣由:黑松資產管理(股)公司董事會通過同意與微風廣場實業(股)公司之 不動產租賃協議書及相關備忘錄，修定延長租賃期間及延長期間租金不調漲， 相關修定內容如下： (1)延長租賃期間：自118年10月26日起延長3年(即至121年10月25日屆至) (2)延長租賃期間商場及停車位租金：以117年10月26日至118年10月25日之租金    作為基準租金。 (3)其他合約條件維持原合約規定不變動。 6.因應措施:無。 7.其他應敘明事項:本案已陳報黑松股份有限公司董事會討論通過。,1234
6,7,111/07/06,16:02:45,杜居燦,財務處處長,27062191#403,代重要子公司客集股份有限公司公告法人代表董事 及監察人改派(補充111.03.22公告),第 6款,111/03/22,1.發生變動日期:111/03/22 2.法人名稱:黑松股份有限公司 3.舊任者姓名: 董  事:張智鈞、蔡曜光、李建論 監察人:杜居燦 4.舊任者簡歷: 董  事:張智鈞/黑松股份有限公司董事 董  事:蔡曜光/黑松股份有限公司行銷處處長 董  事:李建論/黑松股份有限公司業務一處處長兼任業務二處處主管 監察人:杜居燦/黑松股份有限公司財務處處長 5.新任者姓名: 董  事:張智鈞、蔡曜光、李建論 監察人:杜居燦 6.新任者簡歷: 董  事:張智鈞/黑松股份有限公司董事 董  事:蔡曜光/黑松股份有限公司行銷處處長 董  事:李建論/黑松股份有限公司業務一處處長兼任業務二處處主管 監察人:杜居燦/黑松股份有限公司財務處處長 7.異動原因:任期屆滿，全面改選 8.原任期（例xx/xx/xx至xx/xx/xx）:108/02/15~111/02/14 (任期延至改選日111/03/22) 9.新任生效日期:111/03/22~114/03/21 10.其他應敘明事項:無。,1234
