,序號,發言日期,發言時間,發言人,發言人職稱,發言人電話,主旨,符合條款,事實發生日,說明,公司代號
0,1,110/03/19,15:58:05,余奎儒,副總經理,(04)26937689,董事會決議股利分派,第 14款,110/03/19,"1. 董事會決議日期：110/03/19 2. 股利所屬年(季)度：109年 年度 3. 股利所屬期間：109/01/01 至 109/12/31 4. 股東配發內容： 　(1)盈餘分配之現金股利(元/股)：1.30000000 　(2)法定盈餘公積發放之現金(元/股)：0 　(3)資本公積發放之現金(元/股)：0 　(4)股東配發之現金(股利)總金額(元)：546,640,361 　(5)盈餘轉增資配股(元/股)：0 　(6)法定盈餘公積轉增資配股(元/股)：0 　(7)資本公積轉增資配股(元/股)：0 　(8)股東配股總股數(股)：0 5. 其他應敘明事項： 如因本公司買回及註銷庫藏股等，致影響 本公司流通在外股份總數時，授權董事長 依本案決議之普通股分配現金股利總額， 按配息基準日公司流通在外股份之數量， 調整股東配息比率。 6. 普通股每股面額欄位：新台幣10.0000元",1712
1,2,110/03/19,15:58:39,余奎儒,副總經理,(04)26937689,公告本公司110年除息基準日,第 14款,110/03/19,"1.董事會、股東會決議或公司決定日期:110/03/19 2.除權、息類別（請填入「除權」、「除息」或「除權息」）:除息 3.發放股利種類及金額:現金股利總額新台幣546,640,361元，每股配發1.3元 （計算至元為止，元以下捨去，其畸零款合計數計入本公司之資本公積）。 4.除權（息）交易日:110/04/08 5.最後過戶日:110/04/09 6.停止過戶起始日期:110/04/10 7.停止過戶截止日期:110/04/14 8.除權（息）基準日:110/04/14 9.其他應敘明事項: (1)現金股利發放日期：110/05/10 (2)如因本公司買回及註銷庫藏股等，致影響本公司流通在外股份總數時，授權董事長 依決議之普通股分配現金股利總額，按配息基準日公司流通在外股份之數量，調整股東 配息比率。",1712
2,3,110/03/19,15:59:25,余奎儒,副總經理,(04)26937689,公告本公司董事會決議召開110年股東常會相關事宜,第 17款,110/03/19,1.董事會決議日期:110/03/19 2.股東會召開日期:110/06/22 3.股東會召開地點:台中長榮桂冠酒店（台中市台灣大道二段666號） 4.召集事由一、報告事項:  (1)本公司109年度營業狀況報告。  (2)本公司109年度審計委員會查核報告。  (3)本公司109年度員工及董事酬勞分派情形報告。  (4)本公司109年度盈餘分配現金股利情形報告。 5.召集事由二、承認事項:本公司109年度營業報告書暨財務報表案。 6.召集事由三、討論事項:修正本公司「董事選舉辦法」案。 7.召集事由四、選舉事項:無。 8.召集事由五、其他議案:無。 9.召集事由六、臨時動議:無。 10.停止過戶起始日期:110/04/24 11.停止過戶截止日期:110/06/22 12.其他應敘明事項: (1)股東以電子方式行使其表決權期間：110/05/22~110/06/19 (2)依公司法第172條之1規定，本公司擬訂110/04/17~110/04/27止， 受理110年股東常會停止過戶日時，股東名冊記載持有已發行股份總數 1%以上股份之股東，以書面方式提案。 提案受理處所：台中市大肚區中和里南榮路101號（管理部）。,1712
3,4,110/03/19,16:00:07,余奎儒,副總經理,(04)26937689,本公司董事會通過109年度合併財務報告,第 31款,110/03/19,"1.財務報告提報董事會或經董事會決議日期:110/03/19 2.審計委員會通過財務報告日期:110/03/19 3.財務報告報導期間起訖日期(XXX/XX/XX~XXX/XX/XX):109/01/01~109/12/31 4.1月1日累計至本期止營業收入(仟元):17,484,401 5.1月1日累計至本期止營業毛利(毛損) (仟元):4,704,307 6.1月1日累計至本期止營業利益(損失) (仟元):977,812 7.1月1日累計至本期止稅前淨利(淨損) (仟元):851,118 8.1月1日累計至本期止本期淨利(淨損) (仟元):721,519 9.1月1日累計至本期止歸屬於母公司業主淨利(損) (仟元):715,593 10.1月1日累計至本期止基本每股盈餘(損失) (元):1.70 11.期末總資產(仟元):14,955,981 12.期末總負債(仟元): 7,848,552 13.期末歸屬於母公司業主之權益(仟元):7,059,128 14.其他應敘明事項:無",1712
4,5,110/03/19,16:00:45,余奎儒,副總經理,(04)26937689,公告本公司董事會重大決議事項,第 51款,110/03/19,1.事實發生日:110/03/19 2.公司名稱:興農股份有限公司 3.與公司關係(請輸入本公司或子公司):本公司 4.相互持股比例:不適用 5.發生緣由: 本公司於110/03/19召開董事會之重大決議事項如下： 一、通過本公司109年度營業報告書暨財務報告案。 二、通過本公司109年度盈餘分配案。 三、通過本公司109年度員工及董事酬勞分派案。 四、通過修正本公司「董事選舉辦法」案。 五、通過召開本公司110年股東常會案。 六、通過本公司109年度內部控制制度有效性考核及內部控制聲明書案。 七、通過修正本公司「薪資報酬委員會組織規程」案 6.因應措施:無 7.其他應敘明事項:無,1712
5,6,110/03/19,16:01:02,余奎儒,副總經理,(04)26937689,代子公司台灣楓康超市(股)公司公告董事會決議股利分派,第 14款,110/03/19,"1.董事會決議日期:110/03/19 2.發放股利種類及金額:現金股利總額：40,500,000元(每股配發1.35元)。 3.其他應敘明事項:無",1712
6,7,110/03/19,16:01:39,余奎儒,副總經理,(04)26937689,代子公司台灣楓康超市(股)公司公告董事會決議召開 110年股東常會相關事宜,第 17款,110/03/19,1.董事會決議日期:110/03/19 2.股東會召開日期:110/05/18 3.股東會召開地點:台灣楓康超市(股)公司營業廳。(台中市大肚區中和里南榮路59號) 4.召集事由一、報告事項:  (1)本公司109年度營業狀況報告。  (2)本公司監察人審查109年度決算報告。  (3)本公司109年度員工酬勞分派情形報告。 5.召集事由二、承認事項:  (1)本公司109年度營業報告書暨財務報表案。  (2)本公司109年度盈餘分配案。 6.召集事由三、討論事項:無。 7.召集事由四、選舉事項:無。 8.召集事由五、其他議案:無。 9.召集事由六、臨時動議:無。 10.停止過戶起始日期:110/04/19 11.停止過戶截止日期:110/05/18 12.其他應敘明事項:依公司法第172條之1規定，本公司擬定110/04/09~110/04/19止， 受理110年股東常會停止過戶日時，股東名冊記載持有已發行股份總數1 %以上股份之 股東以書面方式提案。提案受理處所：台中市大肚區中和里南榮路59號（管理處）。,1712
7,8,110/03/19,17:02:50,余奎儒,副總經理,(04)26937689,本公司受邀參加群益金鼎證券舉辦之線上法人說明會,第 12款,110/03/23,符合條款第四條第XX款：12 事實發生日：110/03/23 1.召開法人說明會之日期：110/03/23 2.召開法人說明會之時間：14 時 30 分  3.召開法人說明會之地點：線上法人說明會 4.法人說明會擇要訊息：受邀參加群益金鼎證券舉辦之線上法人說明會，說明營運狀況。 報名網址：https://forms.gle/QoRpthVjTHFDwebU7， 活動內容詢問電話：(02)8789-8888 分機 5132 吳小姐 5.其他應敘明事項：無 完整財務業務資訊請至公開資訊觀測站之法人說明會一覽表或法說會項目下查閱。,1712
