,序號,發言日期,發言時間,發言人,發言人職稱,發言人電話,主旨,符合條款,事實發生日,說明,公司代號
0,1,110/05/07,16:11:13,余奎儒,副總經理,(04)26937689,本公司董事會通過110年第1季合併財務報告,第 31款,110/05/07,"1.財務報告提報董事會或經董事會決議日期:110/05/07 2.審計委員會通過財務報告日期:110/05/07 3.財務報告報導期間起訖日期(XXX/XX/XX~XXX/XX/XX):110/01/01~110/03/31 4.1月1日累計至本期止營業收入(仟元):4,829,050 5.1月1日累計至本期止營業毛利(毛損) (仟元):1,315,160 6.1月1日累計至本期止營業利益(損失) (仟元):341,774 7.1月1日累計至本期止稅前淨利(淨損) (仟元):319,583 8.1月1日累計至本期止本期淨利(淨損) (仟元):255,242 9.1月1日累計至本期止歸屬於母公司業主淨利(損) (仟元):252,640 10.1月1日累計至本期止基本每股盈餘(損失) (元):0.60 11.期末總資產(仟元):14,939,468 12.期末總負債(仟元): 8,135,351 13.期末歸屬於母公司業主之權益(仟元):6,753,214 14.其他應敘明事項:無",1712
1,2,110/05/07,16:11:39,余奎儒,副總經理,(04)26937689,公告本公司董事會重大決議事項,第 51款,110/05/07,1.事實發生日:110/05/07 2.公司名稱:興農股份有限公司 3.與公司關係(請輸入本公司或子公司):本公司 4.相互持股比例:不適用 5.發生緣由: 本公司於110/05/07召開董事會之重大決議事項如下： 一、通過修正本公司「誠信經營守則」案。 二、通過投資永續發展金融商品案。 6.因應措施:無 7.其他應敘明事項:無,1712
2,1,110/05/18,16:09:19,余奎儒,副總經理,(04)26937689,代子公司台灣楓康超市(股)公司公告 110年股東常會重要決議事項,第 18款,110/05/18,"1.股東常會日期:110/05/18 2.重要決議事項一、盈餘分配或盈虧撥補:通過本公司109年度盈餘分配案， 配發現金股利總額新台幣40,500,000元（每股配發新台幣1.35元）。 3.重要決議事項二、章程修訂:無 4.重要決議事項三、營業報告書及財務報表:通過本公司109年度營業報告書 暨財務報表案。 5.重要決議事項四、董監事選舉:無 6.重要決議事項五、其他事項:無 7.其他應敘明事項:無",1712
3,1,110/05/21,13:46:18,余奎儒,副總經理,(04)26937689,公告本公司依金管會指示停止召開原訂 110年6月22日股東常會,第 17款,110/05/21,1.事實發生日:110/05/21 2.因應金管會公告之「因應疫情公開發行公司股東會延期召開相關措施」， 故本公司停止召開原訂股東會，後續將另經董事會決議通過， 延至110年7月1日起至110年8月31日期間擇期召開， 本次停止召開之原訂股東會日期:110/06/22 3.其他應述明事項:無,1712
4,1,110/05/28,16:44:36,余奎儒,副總經理,(04)26937689,代子公司台灣楓康超市(股)公司公告110年除息基準日,第 14款,110/05/28,"1.董事會、股東會決議或公司決定日期:110/05/28 2.除權、息類別（請填入「除權」、「除息」或「除權息」）:除息 3.發放股利種類及金額:現金股利總額新台幣40,500,000元，每股配發新台幣1.35元 （計算至元為止，元以下捨去）。 4.除權（息）交易日:NA 5.最後過戶日:110/06/02 6.停止過戶起始日期:110/06/03 7.停止過戶截止日期:110/06/07 8.除權（息）基準日:110/06/07 9.其他應敘明事項:現金股利發放日110/06/10",1712
