,序號,發言日期,發言時間,發言人,發言人職稱,發言人電話,主旨,符合條款,事實發生日,說明,公司代號
0,1,111/05/06,15:59:41,余奎儒,副總經理,(04)26937689,本公司董事會通過111年第1季合併財務報告,第 31款,111/05/06,"1.提報董事會或經董事會決議日期:111/05/06 2.審計委員會通過日期:111/05/06 3.財務報告或年度自結財務資訊報導期間 起訖日期(XXX/XX/XX~XXX/XX/XX):111/01/01~111/03/31 4.1月1日累計至本期止營業收入(仟元):6,073,233 5.1月1日累計至本期止營業毛利(毛損) (仟元):1,668,509 6.1月1日累計至本期止營業利益(損失) (仟元):523,964 7.1月1日累計至本期止稅前淨利(淨損) (仟元):612,195 8.1月1日累計至本期止本期淨利(淨損) (仟元):478,345 9.1月1日累計至本期止歸屬於母公司業主淨利(損) (仟元):475,910 10.1月1日累計至本期止基本每股盈餘(損失) (元):1.13 11.期末總資產(仟元):16,834,116 12.期末總負債(仟元): 9,515,391 13.期末歸屬於母公司業主之權益(仟元):7,262,981 14.其他應敘明事項:無",1712
1,2,111/05/06,16:01:50,余奎儒,副總經理,(04)26937689,公告本公司董事會重大決議事項,第 51款,111/05/06,1.事實發生日:111/05/06 2.公司名稱:興農股份有限公司 3.與公司關係(請輸入本公司或子公司):本公司 4.相互持股比例:不適用 5.發生緣由: 本公司於111/05/06召開董事會之重大決議事項如下： 一、通過更換本公司簽證會計師案(內部輪調)。 二、通過本公司111年第1季興農及子公司合併財務報告案。 三、通過修正本公司「公司治理實務守則」案。 四、通過修正本公司「內部重大資訊處理暨防範內線交易管理作業程序」案。 五、通過修正本公司「企業社會責任實務守則」案。 6.因應措施:無 7.其他應敘明事項:無,1712
2,1,111/05/17,16:08:14,余奎儒,副總經理,(04)26937689,代子公司台灣楓康超市(股)公司公告 111年股東常會重要決議事項,第 18款,111/05/17,"1.股東常會日期:111/05/17 2.重要決議事項一、盈餘分配或盈虧撥補: 通過本公司110年度盈餘分派案，分派現金股利總額新台幣51,000,000元 （每股配發新台幣1.7元）。 3.重要決議事項二、章程修訂:無 4.重要決議事項三、營業報告書及財務報表: 通過本公司110年度營業報告書暨財務報表案。 5.重要決議事項四、董監事選舉:無 6.重要決議事項五、其他事項: 通過修正本公司「取得或處分資產處理程序」案。 7.其他應敘明事項:無",1712
3,1,111/05/20,14:27:32,余奎儒,副總經理,(04)26937689,代子公司台灣楓康超市(股)公司公告111年除息基準日,第 14款,111/05/20,"1.董事會、股東會決議或公司決定日期:111/05/20 2.除權、息類別（請填入「除權」、「除息」或「除權息」）:除息 3.發放股利種類及金額:現金股利總額新台幣51,000,000元，每股配發新台幣1.7元 （計算至元為止，元以下捨去）。 4.除權（息）交易日:NA 5.最後過戶日:111/06/02 6.停止過戶起始日期:111/06/03 7.停止過戶截止日期:111/06/07 8.除權（息）基準日:111/06/07 9.其他應敘明事項:現金股利發放日111/06/10",1712
4,2,111/05/20,14:28:03,余奎儒,副總經理,(04)26937689,本公司受邀參加永豐金證券舉辦之線上法人說明會,第 12款,111/05/26,符合條款第四條第XX款：12 事實發生日：111/05/26 1.召開法人說明會之日期：111/05/26 2.召開法人說明會之時間：14 時 00 分  3.召開法人說明會之地點：線上法人說明會 4.法人說明會擇要訊息：受邀參加永豐金證券舉辦之線上法人說明會，說明營運狀況。 報名網址：https://forms.gle/jb8PnYADuzhy2ZvX6， 活動內容詢問電話：(02)2382-3207鄒小姐 5.其他應敘明事項：無 完整財務業務資訊請至公開資訊觀測站之法人說明會一覽表或法說會項目下查閱。,1712
