,序號,發言日期,發言時間,發言人,發言人職稱,發言人電話,主旨,符合條款,事實發生日,說明,公司代號
0,1,111/11/15,16:31:12,鍾寬仁,總經理,02-2570-0898,董事會決議本公司營運自111年11月16日起全面歇業與停工， 同時解僱全體員工。,第 3款,111/11/15,1.事實發生日:111/11/15 2.事件緣由:本公司111/11/15董事會決議因公司營運困難、財務不佳， 爰依公司法第211條第2項規定向法院聲請宣告破產，為避免虧損 繼續擴大，損及所有債權人權益，故決議自111年11月16日起公司 全面歇業與停工，同時解僱全體員工及解任全體經理人。 3.最近三年度與減產後之產能、產量比較: 近三年產能利用率約65%、60%、55%。減產後為0%。 4.全部或部分停工項目之產能、產量及所佔公司營收比例:100% 5.出租之公司廠房或主要設備明細及其佔總資產比例:0% 6.質押之資產明細及其佔總資產之比例:84.32% (依111年第二季會計師核閱數) 7.決策過程: 本公司111/11/15董事會決議因公司營運困難、財務不佳， 爰依公司法第211條第2項規定向法院聲請宣告破產，為避免虧損 繼續擴大，損及所有債權人權益，故決議自111年11月16日起 公司全面歇業與停工。 8.其他應敘明事項:無。,3383
1,2,111/11/15,16:31:41,鍾寬仁,總經理,02-2570-0898,董事會決議本公司營運自111年11月16日起 全面歇業與停工同時解僱全體員工及解任全體經理人， 發生影響公司繼續經營之重大情事。,第 9款,111/11/15,1.事實發生日:111/11/15 2.發生緣由:本公司111/11/15董事會決議因公司營運困難、財務不佳， 爰依公司法第211條第2項規定向法院聲請宣告破產，為避免虧損 繼續擴大，損及所有債權人權益，故決議自111年11月16日起公司 全面歇業與停工，同時解僱全體員工及解任全體經理人。 3.因應措施: 111/11/15董事會決議向法院聲請宣告破產及全面歇業、停工， 以保障所有債權人之權益。 4.其他應敘明事項:無。,3383
2,3,111/11/15,16:32:02,鍾寬仁,總經理,02-2570-0898,公告本公司董事變動達三分之一。,第 6款,111/11/15,"1.發生變動日期:111/11/15 2.舊任者姓名及簡歷: 舊任董事： (1)IMPERIAL  STAR  HOLDING  LIMITED 代表人：麥獻元    簡歷:新世紀光電(股)公司法務主管 (2)OVERSEAS HOLDINGS LIMITED 代表人：盧俊成    簡歷:國立台北教育大學教育 經營管理學系教授 (3)Genesis Global Communications Venture Capital,INC.代表人：金寧海    簡歷:藍海光電科技(股)公司董事長 舊任獨立董事: (1)魏哲和，簡歷:交通大學電子工程系兼任教授 (2)蕭恩信，簡歷:東昇集團董事長 3.新任者姓名及簡歷:不適用 4.異動原因:辭職 5.新任董事選任時持股數:不適用 6.原任期（例xx/xx/xx至xx/xx/xx）:109/06/20~112/06/19 7.新任生效日期:不適用 8.同任期董事變動比率:6/7 9.其他應敘明事項:無",3383
3,4,111/11/15,16:32:21,鍾寬仁,總經理,02-2570-0898,公告本公司總經理異動。,第 6款,111/11/15,1.董事會決議日:111/11/15 2.變動人員職稱(請輸入〝董事長〞或〝總經理〞):總經理 3.舊任者姓名及簡歷:鍾寬仁 新世紀光電公司董事長 4.新任者姓名及簡歷:不適用 5.異動原因:董事會解任 6.新任生效日期:NA 7.其他應敘明事項: 本公司111/11/15董事會決議因公司營運困難、財務不佳，爰依公司法第211條 第2項規定向法院聲請宣告破產，為避免虧損繼續擴大，損及所有債權人權益， 故決議自111年11月16日起公司全面歇業與停工，同時解僱全體員工及解任全體經理人。,3383
4,5,111/11/15,16:32:37,鍾寬仁,總經理,02-2570-0898,公告本公司向臺灣台南地方法院聲請破產,第 2款,111/11/15,1.法律事件之當事人、法院名稱、處分機關及相關文書案號: 台南地方法院遞狀（地址：台南市安平區健康路三段308號） 2.事實發生日:111/11/15 3.發生原委（含爭訟標的）: 公司法第211條第2項：「公司資產顯有不足抵償其所負債務時， 除得依第二百八十二條辦理者外，董事會應即聲請宣告破產。」 4.處理過程:向法院聲請宣告破產，以保障所有債權人之權益。 5.對公司財務業務影響及預估影響金額: 經董事會通過向法院聲請宣告破產。 6.因應措施及改善情形:依法院程序。 7.其他應敘明事項:無,3383
