,序號,發言日期,發言時間,發言人,發言人職稱,發言人電話,主旨,符合條款,事實發生日,說明,公司代號
0,1,111/03/16,17:46:26,鍾蕊芳,副總經理,02-8789-2000*72710,董事會決議股利分派,第 14款,111/03/16,"1. 董事會擬議日期：111/03/16 2. 股利所屬年(季)度：110年 年度 3. 股利所屬期間：110/01/01 至 110/12/31 4. 股東配發內容： 　(1)盈餘分配之現金股利(元/股)：0.75800000 　(2)法定盈餘公積發放之現金(元/股)：0 　(3)資本公積發放之現金(元/股)：0 　(4)股東配發之現金(股利)總金額(元)：4,266,246,138 　(5)盈餘轉增資配股(元/股)：0 　(6)法定盈餘公積轉增資配股(元/股)：0 　(7)資本公積轉增資配股(元/股)：0 　(8)股東配股總股數(股)：0 5. 其他應敘明事項： 無 6. 普通股每股面額欄位：新台幣10.0000元",2633
1,2,111/03/16,17:51:17,鍾蕊芳,副總經理,02-8789-2000*72710,本公司董事會決議發行無擔保普通公司債,第 11款,111/03/16,1.董事會決議日期:111/03/16 2.名稱﹝XX公司第X次（有、無）擔保公司債﹞:  台灣高速鐵路股份有限公司無擔保普通公司債。 3.是否採總括申報發行公司債(是/否):否 4.發行總額:不超過新臺幣60億元，得自董事會決議日起一年內一次或分次發行。 5.每張面額:新臺幣壹仟萬元整。 6.發行價格:依票面金額十足發行。 7.發行期間:不超過十年。 8.發行利率:採固定利率發行。 9.擔保品之種類、名稱、金額及約定事項:不適用。 10.募得價款之用途及運用計畫:償還債務、充實營運資金。 11.承銷方式:委託證券承銷商對外公開承銷。 12.公司債受託人:授權董事長或董事長指定之人決定。 13.承銷或代銷機構:授權董事長或董事長指定之人決定。 14.發行保證人:不適用。 15.代理還本付息機構:授權董事長或董事長指定之人決定。 16.簽證機構:不適用。 17.能轉換股份者，其轉換辦法:不適用。 18.賣回條件:不適用。 19.買回條件:不適用。 20.附有轉換、交換或認股者，其換股基準日:不適用。 21.附有轉換、交換或認股者，對股權可能稀釋情形:不適用。 22.其他應敘明事項:無。,2633
2,3,111/03/16,17:51:39,鍾蕊芳,副總經理,02-8789-2000*72710,公告本公司董事會通過捐助「烏克蘭難民援助計畫」乙案,第 43款,111/03/16,"1.事實發生日:111/03/16 2.捐贈原由:協助烏克蘭境內流離失所的人民，維持基本生活及健康之必需。 3.捐贈金額:新台幣3,000,000元 4.受贈對象:財團法人賑災基金會 5.與公司關係:關係人(政府關係個體) 6.表示反對或保留意見之獨立董事姓名及簡歷:無 7.前揭獨立董事表示反對或保留之意見:不適用 8.其他應敘明事項:依本公司111年3月16日第九屆第二十四次董事會決議辦理。",2633
3,5,111/03/16,17:51:56,鍾蕊芳,副總經理,02-8789-2000*72710,公告本公司董事會通過「2022共植美好」永續發展計畫之 林地認養贊助案,第 43款,111/03/16,"1.事實發生日:111/03/16 2.捐贈原由:本公司捐贈認養兩處林地，一為屏東縣恆春事業區面積5公頃林地，  二為雲林縣西螺鎮面積1.35公頃林地。 3.捐贈金額:不逾新台幣4,700,000元 4.受贈對象:行政院農業委員會林務局 5.與公司關係:關係人(政府關係個體) 6.表示反對或保留意見之獨立董事姓名及簡歷:無 7.前揭獨立董事表示反對或保留之意見:不適用 8.其他應敘明事項:依本公司111年3月16日第九屆第二十四次董事會決議辦理。",2633
4,1,111/03/18,16:40:51,鍾蕊芳,副總經理,02-8789-2000*72710,公告本公司受邀參加111年3月21日國泰綜合證券舉辦之線上法人說明會（電話會議）,第 12款,111/03/21,符合條款第四條第XX款：12 事實發生日：111/03/21 1.召開法人說明會之日期：111/03/21 2.召開法人說明會之時間：14 時 30 分  3.召開法人說明會之地點：線上法人說明會 4.法人說明會擇要訊息：公司營運狀況說明 5.其他應敘明事項：受邀參加國泰綜合證券舉辦之線上法人說明會（電話會議） 完整財務業務資訊請至公開資訊觀測站之法人說明會一覽表或法說會項目下查閱。,2633
